a bit nauseous. concerned for this person. ,2.9047619047619047,2.925
"A bit sad. this man seems to be in a lot of pain, and I don't want him to be in pain anymore. Concerned, sympathetic.",2.5454545454545454,3.238095238095238
A cute baby is smiling. He looks like he's having a good time at home. He's probably playing with his parents.,3.477272727272727,3.6666666666666665
A cute baby looks surprised. She's wearing an adorable headband. She looks dressed up.,3.522727272727273,3.0714285714285716
a feel a little disgusted and also sad that someone lost their hand I wonder what happened.,2.953488372093023,3.6097560975609757
"A feel the boys uncomfort. I hope he gets out of there soon, the dentist sucks.",2.604651162790698,3.2195121951219514
"A girl standing. she appears kind of confused or uncertain, but not that bad. ",3.744186046511628,3.5853658536585367
a hero will come save the man. the cops will arrest red shirt dude. the gun will be out of ammo. someone will help.,3.8181818181818183,4.309523809523809
A kid is crying? But that's only because of a tiny quarrel? She will be fine. It's no big deal. No big deal.,2.9302325581395348,3.4390243902439024
A kid who has come to the world too early. But he or she will be fine.,3.697674418604651,4.097560975609756
"A man is smiling. I'm not sure what he's smiling about. I feel the tiniest bit creeped out. But I hope it's about something happy, then I could be happy too. ",2.8863636363636362,3.2857142857142856
A photoshopped photo. It must be the case. IT's fake.,3.1951219512195124,3.5384615384615383
A stylish phone call? Interesting. A cozy home it is. Afternoon sunshine.,3.4047619047619047,3.225
A teenager looks kind of pissed that she has to take this photo. But she seems to be fine. I hope she's actually happy.,2.880952380952381,3.325
A terrible disease has struck this person? Is there a treatment? This is bad.,3.2325581395348837,3.4390243902439024
"A woman is on a phone call and casually doing some yoga while she's on it. I do that sometimes too, not yoga but do other things while I'm on the phone. This makes me feel neutral.",3.7804878048780486,3.128205128205128
"A woman is smiling at the beach. I love the beach. Her hair looks great. I think she's having a good time, and I'm happy for her if she is. I like her outfit too.",2.7857142857142856,3.7
A woman's face looks like it got hit in the eye area. I hope it was an accident and I hope she is okay. She looks dressed up. It seems like domestic abuse.,3.4318181818181817,3.5238095238095237
A young man ready to face the challenge of life? He is serious but not afraid.,3.590909090909091,3.7142857142857144
Abuser was just taken away by the police. Maybe some on film makeup or news makeup to try ,4.488372093023256,4.097560975609756
"Again Nauseous. Hand is disfigured, slightly uncomfortable.",3.4651162790697674,2.7560975609756095
all of the person's intestines are coming out ? I kind of feel nauseous looking at this image.,3.2954545454545454,3.119047619047619
allergies. these are just seasonal allergies. will get better. put tea bags on eyes.,4.27906976744186,3.073170731707317
An injured young man. Will he get better? Need some time.,4,3.8
An old man is crying because he saw something so happy. His granddaughter wanted to take a picture of his eyes.,4.428571428571429,3.275
"Another baby is smiling aww. This picture makes me feel good. The baby's eyes are twinkling, maybe because of his or her parents?",3.2954545454545454,2.9761904761904763
Another baby? I like how this one has a little thing going on with their hair?,2.857142857142857,2.825
"Another medical injury. A lot of these injuries aren't too bothersome, maybe I'm just used to it though.",3.302325581395349,3.268292682926829
Another person getting portraits done for something. I don't really have a lot to say about these ones.,3.75,3.5714285714285716
Another portrait. These are pretty uninteresting to look at and don't really influence my emotion I find. Maybe that's intentional.,2.857142857142857,2.55
Another smiling baby. Puts me in a good mood. It seems happy.,2.5714285714285716,3.025
At least there're people who care for her. Hope she will be fine. She can keep her eyes.,3.2439024390243905,3.641025641025641
Aww a baby is smiling and this picture makes me smile and feel happy. I love babies. So cute.,2.5476190476190474,2.8
"aww a cute baby, you can see the tear almost coming out of her right eye, but this makes me kind of happy and pleased.",2.9545454545454546,2.6904761904761907
"Aww a smiling baby, I love the babies in here, she's so happy makes me smile too?",2.6818181818181817,2.9761904761904763
"Aww at least he's in bed at the hospital and the doctors are rushing to save him, I'm sure he's just covered in some red liquid he'll be fine.",3.2790697674418605,3.8536585365853657
"aww it's a cute baby again this is good eye bleach I feel more relaxed, but not happy.",2.5476190476190474,2.9
"aww she has a red eye, I empathize with her since my eyes always seem to get red also.",3.0681818181818183,2.8333333333333335
"aww the baby she's holding out her hand and is really cute I'm loving this picture, I'm so happy.",2.5952380952380953,2.6
"Aww, the poor thing. At least babies recover pretty quickly.",3.1818181818181817,3.238095238095238
awwww so darn cute. I feel happy and warm. the baby's smile makes me smile.,2.3636363636363638,2.9285714285714284
Babies? This one doesn't have a lot of hair. So happy though.,3.475,2.9473684210526314
baby at NRG stadium after hurricane Harvey. shelter baby. no parents. wants his or her mom.,4.523809523809524,4.15
baby from a Midwest family. or somewhere in Kansas. youthful. spaghetti bowl child.,4.25,4.428571428571429
Baby is walking out and saw their ice cream held by someone else?,4.809523809523809,3.525
"baby looking up, I feel scared for the baby since the baby is alone, I'm truly frightened something might happen.",2.8095238095238093,3.05
"Baby seems concerned, not exactly happy or sad, and I feel pretty indifferent.",3.0238095238095237,3.35
Baby seems concerned. I am also slightly concerned for the baby.,2.7857142857142856,3.15
Baby seems mystified by the finger and excited for what new experiences are to come.,3.2093023255813953,3.3658536585365852
"Baby was born prematurely? Malnourished, and the recovery center will make sure that the baby will grow to be healthy and well.",4.4186046511627906,4.048780487804878
beautiful 1980s cover model. nice jacket. on beach. nice smile. hand placement is nice.,3.488372093023256,4.609756097560975
bloody face. very graphic. bruised eye. hit on forehead and nose. scraped neck. white.,5.404761904761905,3.075
bodies piled. blood everywhere. war scene. abuse. prisoners of war. filthy.,4.8604651162790695,4.317073170731708
boy lost a part of jaw. I can see his molars. wonder how this happened. poor boy. boy seems fairly sad.,3.7142857142857144,3.2
breast cancer will be cured. doctors will help her and she will spend more years with family. science is advanced.,3.7906976744186047,4.463414634146342
burn victim. a child or kid. kid is traumatized. blue eyes. white skin.,5.166666666666667,3.925
charcoal body. cut open on the side. some yellow tint on side. looks like a mummy. red flesh cable.,5.045454545454546,3.3333333333333335
chubby baby. baby grasping reflex. innocence. bright future. big eyes. white pill.,4.116279069767442,3.4878048780487805
Concerned for them. A bit confused as to what I'm quite looking at.,2.6744186046511627,3.3658536585365852
"Concerned. Humoured as well since the kid is making a sort of funny, yet strained expression.",3.0476190476190474,3.15
Confused as to what they're looking so intensely at. A little bit unnerved. ,2.857142857142857,3.425
creepy stache. OITNB smoked in the past? 70s or 80s.,3.4047619047619047,4.625
curing someone. I feel okay because they are helping someone in need.,3.3488372093023258,3.658536585365854
Cute baby. It looks like an online meme. Cool expression. enjoying life.,3.0476190476190474,3.6
Cute little baby. Baby smiling makes be a bit happy too. It's so pure.,2.744186046511628,3.024390243902439
Cute picture of a baby. Looks like the baby is having a fun photo shoot. Cute.,2.8095238095238093,3.25
"damn that's one messed up hand, I feel terrible and horrified by this hand, I hope it never happens to me.",2.813953488372093,3.3902439024390243
Deep stare. Concerned. A bit nerve racked since it's so serious looking. ,3.372093023255814,3.073170731707317
Disgusted and concerned. Not really wanting to be looking at the image. A bit shaken up.,2.7906976744186047,3.073170731707317
"doctors doing surgery. knife, what are they operating on? 80s picture. hope they are clean. ",4.25,4.976190476190476
domestic violence victim. poor woman. no man should lay his hands on a woman. didn't deserve this. dressed up nice.,3.3333333333333335,4.25
"Eesh. They look pretty young, so they were probably born with the deformities at birth.",3.0238095238095237,3.6
"Elderly man. He enjoys life, right?",3.4318181818181817,3.5714285714285716
EMT. EMS. face is burnt. Lots of blood. unconscious. body sensors. ,5.295454545454546,3.0238095238095237
"Even though this man got seriously hurt, he got admitted into the hospital, where he got good treatment and plastic surgery, and he recovers. His loved ones visit him.",5,3.975
face was squashed. gash on head. fresh wound. unconscious. pale skin.,5.372093023255814,3.4390243902439024
fall season. 80s baby nice sweater. Marley and me movie. playground in back. brown leaves. soft skin. cool weather.,4.682926829268292,4.153846153846154
"Feeling fine, just an adult woman oh wait her bone I feel bad but it looks like she's learned to deal.",2.707317073170732,3.3076923076923075
Film about aliens. Cool effects? Makeup? Artistry. Not real.,4.1395348837209305,3.926829268292683
Grossed out. What's wrong with this person? I'm concerned for them.,2.5238095238095237,3.225
"Guy got ketchup or wine thrown on him, and he seems angry or surprised that it happened.",4.023255813953488,3.8048780487804876
"Half of this boy's face is missing?? It reminds me of two face from Batman, which actually really grossed me out when I first saw it. I feel really bad for this boy. His mouth just looks terrible.",2.8863636363636362,3.3095238095238093
Happy baby picks me up slightly after the other images I've seen. ,2.5952380952380953,2.925
happy baby. innocence. think my heart slowed down seeing this after the previous picture. good feeling. purple light is nice.,2.627906976744186,3
happy baby. very well fed. nice color shirt. will start teething soon. bald hair. some hair.,4.558139534883721,3.3902439024390243
he has a lot of wrinkles on his face which means he must be really tired and old and stressed. he seems to be thinking about something.,3.357142857142857,3.4
he has really nice hair and lips.. his eyes are kind of scary though. I don't know why he looks so intense.,2.813953488372093,3.097560975609756
He is at the dentist or something. He will be able to miss school. It happens to everyone.,4,3.7
He is beaten? Hopefully not very serious. Not serious. It's ok.,3.116279069767442,3.3902439024390243
He is handsome. A vampire? Old English young gentleman? ,3.0697674418604652,3.951219512195122
He is handsome? Beautiful autumn scene? He's exploring nature.,3.272727272727273,3.5476190476190474
he is happy that he is able to stand up again. He seems like he is giving it his all.,3.642857142857143,3.475
He is just waking up after a surgery. He still may be under anesthesia.,5.225,3.3157894736842106
He just got paint thrown at him as a prank and he is yelling at his friends for it.,4.714285714285714,3
he looks a little creepy but I don't feel too negative about this picture.,2.8636363636363638,3.380952380952381
"he looks fine to me, I'm not feeling too much, I hope he doesn't live out in the hot  sun all day, slightly interesting.",3.0681818181818183,3.5238095238095237
"He looks fine to me, just some slight pain maybe while the doctors treat him, he's in good hands.",3.2093023255813953,3.4146341463414633
He looks happy and confident like he just won an award or something similar.,3.5348837209302326,3.097560975609756
He looks quite content. Nothing out of the ordinary.,3.522727272727273,3.119047619047619
he makes me feel nothing really.,3.0714285714285716,3.35
"He seems concerned, wise. I feel like he's gone through a lot and I'd like to talk to him about what he's gone through in his life.",2.9302325581395348,3.707317073170732
He was on the brink of starvation but he's been brought in and helped by nutrition specialists and is being fed through an IV tube.,5.069767441860465,3.7560975609756095
He will be fine. He will be fine. ,3.0714285714285716,3.4
He will be fine. He's in hospital. His family is with him. It's nonfatal.,4.5476190476190474,3.8
He will be fine. We have the technology to save him. It's all right. It will be over.,3.4523809523809526,3.275
he's just been stitched up and he still has one working eye the doctor.,5.209302325581396,3.4878048780487805
he's kind of attractive.,2.2790697674418605,3.073170731707317
he's kind of sneering at me I don't like his face? smile he needs to stop. He makes me feel anxious.,2.590909090909091,2.4285714285714284
He's slathered paint on him to help emphasize a point he's making in his speech to hype up his crowd. What a smart man.,3.7674418604651163,3.4146341463414633
"He's smiling, and that makes me smile? Happy too since they seem to be having a good time doing whatever it is they are doing. ",2.6744186046511627,3.268292682926829
"he's so red, I feel a little sorry for him, mostly curious about whether he has a skin condition or not.",3.2045454545454546,3.3095238095238093
"hello baby can I pick you up? that blanket also looks super comfortable, I hope you are cozy.",2.2325581395348837,2.1463414634146343
"help is on the way? the baby is still alive, there is still hope, everything will be ok.",3.3488372093023258,3.1707317073170733
Her face is just makeup or a mask. The blood is fake blood. ,4.6976744186046515,3.292682926829268
his face is gone I can't recognize it this is too intense for me I feel extremely nauseous and horrible.,2.5348837209302326,2.5121951219512195
his face is really orange? red? either the room he is in is really hot or the lighting is weird so his face looks a strange color. ,3.255813953488372,3.2439024390243905
his hand got shredded off. this looks like a Halloween prop. that must've hurt if it was real. blood is very read. Flesh.,3.6818181818181817,3.2857142857142856
his skin will heal. the skin will peel off like lizards and the underneath will be smooth as a baby.,4.255813953488372,3.951219512195122
his whole body must be hurting so much ? burns are so incredibly painful. his face is also blistering and may get infected because there is so much blood everywhere.,3.116279069767442,3.1463414634146343
Hopefully only these people are hurt.,2.86046511627907,3.658536585365854
Horrible crime? This is too cruel. Terrible. Sad.,2.395348837209302,3.5365853658536586
Horrified. Really concerned for this person and somewhat curious as to how they got this way.,2.441860465116279,3.682926829268293
Horrified. That's a gruesome image. I'm a bit saddened by this action.,2.5348837209302326,3.341463414634146
How cute she is? Adorable big eyes. Though a little scared? Not that ,2.5853658536585367,3.282051282051282
"Huh this is kind of a dark looking portrait. IT doesn't really make me feel bad or anything, but it does elicit some curiosity.",3.3255813953488373,3.268292682926829
Huh what happened there. It looks like they perhaps had a medical experiment.,3.6666666666666665,3.725
"Huh, I guess they're just doing some good 'ol yoga on the phone. I don't have a lot to say here, but they're probably fine.",3.5348837209302326,3.341463414634146
hungry child. needs food. underweight birth. very weak. loose skin. couple days or weeks old. ,4.809523809523809,4.075
I am actually pre-dental. dentists are great? great opportunity to establish patient relationship. dentist is doing good.,3,2.948717948717949
I believe he is fine.,2.6666666666666665,3.325
I believe that there is someone getting ready to come and save the day.,2.86046511627907,3.926829268292683
"I cannot change, this is bloody. He is miserable. I don't have a way.",2.857142857142857,2.7
I don't know what this is. Hopefully she is all safe and healthy. ,2.9285714285714284,3.7
I don't know what this is. I assume some one is receiving surgery to save their life.,3.511627906976744,3.8536585365853657
"I don't know why, but babies make me feel better than random adults.",2.619047619047619,3.25
"I don't really have a lot to say here, I'm not sure why. ",2.909090909090909,2.9047619047619047
I don't really understand the writing/drawing on this person's face but they don't seem very happy... it kind of makes me uneasy.,3.0238095238095237,3.4
I feel a bit disgusted but I cant exactly tell what this is so I don't feel too bad.,2.880952380952381,3.2
I feel a little concerned but it also doesn't look real.,2.8333333333333335,3.575
I feel a little happy. The baby is smiling at me and it's very cute.,2.9047619047619047,2.5
I feel a little happy. This babies facial expression makes me smile.,2.488372093023256,3.024390243902439
I feel a little uncomfortable with the image but she could be good.,2.883720930232558,3.4390243902439024
I feel bad for this person. His condition looks painful. I have sympathy for him.,2.6666666666666665,2.975
I feel disturbed and distressed that this happened.,2.604651162790698,3.097560975609756
I feel disturbed and scared. The image is scary but also sad. I hope its not real.,2.2045454545454546,2.8333333333333335
I feel disturbed and upset that this happened to someone.,2.4545454545454546,3.5952380952380953
"I feel disturbed, but this image could be fake, so I feel like disturbed. Also sad that this may have happen.",2.5454545454545454,3.1904761904761907
I feel fine. The baby looks like it need something but its holding a mom's hand so its ok.,3,3.15
I feel like throwing up my eyes are watering slightly.,2.9069767441860463,2.1219512195121952
"I feel neutral. His smile is nice, just like any other person in the world.",3,3
I feel neutral. Normal baby. Cute hair. ,3.3488372093023258,3.1951219512195124
I feel neutral. Not upsetting. The person in the picture looks like a normal person.,3.642857142857143,3.475
"I feel neutral. she looks like a normal girl, doesn?t seem like anything bad is happening.",3.2790697674418605,3.097560975609756
I feel neutral. She seems comfortable?. This image is a little relaxing as well.,2.7857142857142856,3.425
I feel neutral. the lighting in this picture make it give off a peaceful vibe. I like this guy.,2.8863636363636362,3.2857142857142856
"I feel nice, baby is cute.",2.6818181818181817,2.738095238095238
I feel sad and disturbed but maybe the person is getting help and will be okay. ,2.697674418604651,3.3658536585365852
"I feel sad, he looks like he's in pain.",2.488372093023256,3.1707317073170733
I feel sympathy for her and I hope she gets better.,2.477272727272727,3.2142857142857144
I feel upset and sad and distressed. This looks very painful and if he's ok its something he will deal with for the rest of his life. ,2.7954545454545454,3.4047619047619047
"I have sympathy for this person, but they also look like they're being attended to, so I'm not too worried.",3.3095238095238093,3.325
I love the color of that sweater and the season of fall? the baby seems to be having a great time playing in the leaves.,2.7209302325581395,2.8780487804878048
I think he just got rescued or barely made it out of a brining building.,3.738095238095238,3.725
I'm a little upset. it looks painful and he seems a little off.,2.5121951219512195,3.1794871794871793
"I'm feeling nauseous and slightly horrified by this bloody face, slightly afraid, but curious.",2.9523809523809526,2.875
"I'm mostly confused about what's going on here. Whatever this is, they look like an alien. Very likely from a movie, but idk.",2.8333333333333335,3.75
I'm not sure what's happening in this but it looks really uncomfortable and gross ? why is she all yellow and brown.. what is she covered in..?,2.9767441860465116,3.1707317073170733
"I'm scared because I can't see exactly what's going on at all, I'm pretty anxious I need to know.",2.5476190476190474,2.825
"I'm upset and worried, I hope he gets better. His injuries look bad.",2.840909090909091,3.0952380952380953
innocence nice white colors. baby has a future. parents care for her. relaxed. no worries. soft skin.,3.7674418604651163,3.975609756097561
innocent toddler. pupils shine. wearing a dress. white tile background. soft skin. soft hair.,4.681818181818182,3.5476190476190474
"Is he a good fellow? He's smiling but, like a gang leader? Hope its good.",2.9523809523809526,3.75
"Is that his neck? It looks like someone's neck got sliced open, which is disgusting. Maybe he can stay alive. I hope he's not in pain.",3,3.4390243902439024
Is this a movie actor? I don't have a lot to say here.,3.6818181818181817,3.7857142857142856
Is this the same person that appeared before? But he is handsome enough. Not bad.,2.738095238095238,3.175
It looks like a professional pic of someone from the 80s or 90s maybe 70s.,4.204545454545454,5.214285714285714
It looks like a snapshot of an actor in 90s or 2000s film.,4.186046511627907,4.609756097560975
It looks like a statue you see at a museum of history. Its beautiful.,3.4186046511627906,3.1463414634146343
It looks like another professional pic. He looks cool like he is going to sell an album or get a job.,3.6818181818181817,3.9047619047619047
IT looks like he is relaxing or something.,3.340909090909091,3.1904761904761907
It looks like he is trying to take a cool picture.,3.3636363636363638,3.0714285714285716
It looks like she is getting surgery for breast cancer. Hopefully she can survive.,3.558139534883721,3.6341463414634148
"it looks severe, but its really not as bad as it looks.",3.3488372093023258,3.3658536585365852
it probably looks worse than it is I hope.,2.9069767441860463,3.4634146341463414
It will be fine. His family is with him. He is being sent to hospital.,4.209302325581396,3.658536585365854
It's a disfigured hand. The puddle looks like blood. It makes me feel really gross and I don't like looking at it. ,3.0681818181818183,3.0238095238095237
It's a surgery? It's meant for the good. Kind gross though.,3.4047619047619047,3.4
it's just a dummy. this was actually a painting style developed by a crazy artist? look at the red on the wall.,3.883720930232558,3.5609756097560976
it's probably a scene from a movie so no one will actually get hurt and everything will be okay ? the gun is probably fake.,3.395348837209302,4.073170731707317
It's sad. A person may have come to the end of life. He looks sad.,2.8372093023255816,3.5853658536585367
It's someone happy at the beach instead of a baby this time? I think it's interesting how the color schemes of happy and sad images are different.,3.4318181818181817,3.6904761904761907
Its a cute baby enjoying his or hers time. The smile is contagious.,3.2790697674418605,3.1951219512195124
"its a Halloween costume thing, I don't feel too bad.",3.5714285714285716,3.35
its a premature baby? there's so many tubes.,3.9285714285714284,3.45
Its another beautiful picture of a baby enjoying the autumn season.,3.7954545454545454,3.5
its fake.,3.880952380952381,3.3
"just a couple of homies hanging out, and one of them wanted to show off his new cool gun and is pranking the friend.",4.238095238095238,3.725
Just a regular little girl in a picture. Nothing to feel.,4.119047619047619,3.525
"Just got some kind of disease on the breast. It's a little startling, and scary as well.",3.317073170731707,2.769230769230769
Just had some surgery of some sort. Concerned about what happened in the surgery.,4.0227272727272725,3
Just rescued this child from some dangerous battle or situation.,4.682926829268292,3.051282051282051
looks horrible.,2.0930232558139537,2.8780487804878048
Looks like she is talking to someone she likes or is just talking.,3.6666666666666665,3.7
Looks like they're about to do some surgeries. Another day in the OR probably. ,4.093023255813954,3.5609756097560976
"makes me feel creeped out, vulnerable.",2.340909090909091,2.761904761904762
Man has burn scars. Sympathetic. Hoping that he will recover. ,3.7954545454545454,3.880952380952381
man was cut in the neck. arteries. bled out. cut on major vein. skillful assassin.,4.976744186046512,4.097560975609756
man with depression or some mental problem. strange gaze. wears black. red background and pale skin. vampire. twilight family.,4.232558139534884,3.926829268292683
man's getting a heart transplant that's a bad heart and he can finally get a new one he's been waiting forever.,4.487804878048781,4.076923076923077
Maybe she is just posing for a picture. IT looks like makeup. ,3.697674418604651,3.5609756097560976
"Maybe this is fake. Not like real. But still, strange.",3.3255813953488373,3.2195121951219514
More cute babies ? I think its kind of funny how its mostly babies used for the happy uplifting things and medical injuries for negative.,2.9302325581395348,3.048780487804878
"Movie about aliens? Experiments, and this is a failed one or something.",4,3.682926829268293
"nervous, hope the baby turns out okay, I feel exposed but strangely calm at the same time maybe.",2.7804878048780486,2.923076923076923
"neutral and a little happy. She looks like she's having a good time. The beach is nice, also makes me feel good.",2.9302325581395348,3.268292682926829
neutral feeling. he looks like any other normal person. maybe he's nice idk.,3.272727272727273,3.5238095238095237
neutral. his red face is a little creepy but maybe just bad lighting?,3.2325581395348837,3.4390243902439024
neutral. this is just a face of an expressionless man. don't evoke much emotion in me.,3.4285714285714284,3.35
