This really looks like its from a movie. So maybe its not so bothersome to me.,3.2142857142857144,3.675
This severely anorexic boy was admitted into the hospital and treated for his disorder. He eventually gets better and eats healthily and gets a healthy body?,5.071428571428571,4.225
This woman has a cut near her genitals. It makes me feel sad. Either someone else did that to her or it's self-mutilation.,3.1666666666666665,3.7
"this woman looks like she's in an abusive relationship, but as long as she gets help and stays away from whoever hurt her, she will be okay.",3.255813953488372,3.8048780487804876
This woman's face is badly hurt. I don't like the sight of blood. She looks like she got beat up from the bruise on her eye. This makes me feel bad and sad.,3.119047619047619,3.475
upset that he's been abused and worries.,3.3863636363636362,3.9047619047619047
very bloody. what is in his mouth. blood looks dry on forearm. very skinny boy or girl.,4.511627906976744,3.4390243902439024
very old picture. man is sunburned or graphics are red. confused look. 90s haircut. suit. can seem some of his time. ,4.930232558139535,5.146341463414634
very red face. is this guy Martian. man just came out of oven or something. pupil shining. solid black hair.,4.069767441860465,3.6341463414634148
very wise man. years of wisdom and experienced. his hat is chill. want to have coffee with him. ,2.9318181818181817,3.119047619047619
"Wait no this one is a sad baby D? They're in care though, so they should be alright. ",3.238095238095238,3.6
Were just saved from some freak accident. They'll recover from that horrid wound. ,3.5454545454545454,3.5
"What a cute baby? This one actually makes me feel a bit happy, and I'd probably make a comment about the picture if I was in a group of people about how cute.",2.3636363636363638,3.0952380952380953
What an interesting looking guy. I don't really like his mustache.,2.5952380952380953,3.35
what in the world happened to that hand? it might not be able to be repaired but who ever it is will definitely be okay because prosthetics are available.,3.3333333333333335,3.675
What interesting eyes she has. They're pretty.,2.5813953488372094,2.5853658536585367
What movie is this from? Interesting? Nice beard?,3.3095238095238093,3.825
What's in this person's mouth I wonder. It makes this whole scene look very sci-fi.,2.857142857142857,3.675
What's this ? It is terrible and kind of gross. This appears to be gross.,2.238095238095238,3.25
"What's this? Oh, a devil? Ugly and horrible.",2.2857142857142856,2.85
what? a Halloween set. white head? I see 3 teeth. this looks fake.,3.7954545454545454,3.4523809523809526
Where's he looking? I'm interested to see where he is looking at.,2.5348837209302326,3.1951219512195124
where's the eyeball hole in nose. teeth are messed up. burnt skin? red skin. deformed face. cheek bone.,4.767441860465116,3.3902439024390243
why is he covered in blood but does not look like he's in pain ? that looks like it would hurt a lot yikes what happened.,2.659090909090909,3.357142857142857
Why is he so agony? Is he in prison? What has happened to him?,2.738095238095238,3.85
woah he's bloody but he's lying horizontal so I think he's being taken care of so I think he'll end up okay.,3.372093023255814,3.5365853658536586
"Woah that's scary at first, but she's on the hospital bed and the doctors are helping fix her lifelong problem now and I'm happy for her.",3.116279069767442,3.6341463414634148
"woah that's some nice makeup there, he's definitely an actor or a clown at an emo person's birthday party or something.",2.8863636363636362,3.357142857142857
worried for the babies health but hopeful because her? she is getting taken care of. ,3.1136363636363638,3.2857142857142856
Wow how innocent she is? Though a little unhappy. Cute hair.,2.953488372093023,3.1951219512195124
Wow she is beautiful? She is bathed in love and warmth?,2.7209302325581395,3.292682926829268
"wow, surprised , star-struck that's me right now. I'm in awe and happy.",2.372093023255814,2.731707317073171
"Wow, yet another baby photo? How cute? I like him or her.",2.5952380952380953,3.25
"young man? woman growing up, I feel nostalgic, remembering my days of growing up and rebelling against parents wishes and society.",2.7906976744186047,5.048780487804878
