,response,score,observed
273," A burned body, it almost looks inhuman or made of stone.",3.75,3.609621047973633
274,Tommasiello originally gained online attention for being a fixture in the NYC club and party scene; his Instagram handle is tattooed on his right wrist.,6.5,2.2534263134002686
275, She is wearing a hat and long socks.,6.75,2.7461156845092773
276," They are in the middle of an argument and the woman is like ""what am I supposed to do"".",4.0,2.78910493850708
277, There is a man holding a knife to her throat.,7.0,2.022592306137085
278," Long time ago, far away, someone masked was looking evilly ahead, ready to pounce.",6.25,2.7615675926208496
279, disagreement between mother daughter and mom looks confused.,4.25,3.1616432666778564
280, Just a crusty looking white girl.,2.75,2.973749876022339
281,A man is yelling at a woman and is pointing his hands at her.,7.0,3.4574992656707764
282, These three boys are looking at something off camera that is funny and exciting to them.,6.75,3.179975748062134
283, They seem to have an infection of some kind and it looks like alien slugs.,2.75,3.850773811340332
284,"A child wear red in between two adults wearing black, he covers his ears.",7.0,2.868370532989502
285, White man is choking a white women while he hits her.,7.0,2.995215654373169
286, There are 5 people shown.,6.75,3.1747400760650635
287, A car flipped and firemen and other people saving someone that person was probably in the car.,6.5,2.627030849456787
288,Share more of your story.,5.5,2.971714973449707
289, A man is grasping a woman's throat some time ago in the past.,6.5,3.004790782928467
290, There is a boy running past an armed gunman.,6.75,2.931143283843994
291, People looking at a car doing some shady stuff.,3.5,3.512240409851074
292, there is a dead mans body its very bloody in the face and it is split at the nose.,7.0,6.232851982116699
293,there is a severed hand that is balled in a fist .,7.0,3.7212514877319336
294, That is such a cute baby.,1.5,2.3004448413848877
295, Firemen are rescuing woman from a fire.,6.25,2.9541704654693604
296, Looks to be a child maybe from the rubble of a collapsing building.,3.75,3.5917255878448486
297,"I move my body because I know it helps with my anxiety, I know it helps to clear my mind, I know it's essential for my well-being.",1.75,2.76353120803833
298, Babies are very good.,1.25,2.9062633514404297
299, I have no negative emotions related to this image.,1.5,3.422165632247925
300," his face had been disfigured, his lips were curled in and his skin was peeling.",6.5,3.8282275199890137
301, The other woman was frustrated at that time too.,2.75,3.1882529258728027
302," person staring into the face, neutral picture, not much happening.",2.75,3.773716926574707
303,"But when we look at young people, we don't see the same problem as we do with the older generation.",3.5,3.143512487411499
304, a Young girl is sitting in a chair reading a book.,6.75,4.69542932510376
305, he had on a mask so no one could see his face.,5.5,3.475271701812744
306, Blood is covering certain areas .,7.0,2.3750386238098145
307, This is a nice picture of a chef holding a baby.,2.75,6.043728828430176
308," Again, looks like it's from Eastern Europe, but a man in a black suit is holding the collar of a man in a beige suit.",5.0,5.091733932495117
309, there is a little baby girl sitting in a hospital wheelchair with many tubes attached to her.,6.5,3.0081369876861572
310, A bloodstained man is trying to escape from some soldiers.,6.0,3.1708195209503174
311, this picture is blurry too which feels like the picture was taken while they were moving.,4.0,2.72757625579834
312, Face is white with blank expression.,4.25,2.7197370529174805
313, A corpse with a slit throat.,6.75,3.3960087299346924
314, A person has duct tape over their mouth with police officers surrounding them far in the past/long time ago.,6.5,2.6251771450042725
315, He has professional clothes on.,4.25,2.4686782360076904
316," Person made to look a little unkept, holding a guy with anger.",4.75,2.8444643020629883
317, There is a woman looking away from the camera.,6.75,2.9253907203674316
318," The guy is playing a guitar but does not seem to have an audience, the scene seems kind of sad, he is in a town and trying to make a living.",2.75,2.5136919021606445
319, There's a really happy baby in the photo who's looking straight ahead.,3.5,4.873305797576904
320, A man looking at a woman that is pointing her finger to him.,6.5,3.2497410774230957
321, There is a man pointing a gun towards someone's home.,6.75,2.442540168762207
322," two older individuals stand at a dock of some bay, and wave at the camera.",6.5,2.763152599334717
323,But IT IS real!,1.0,3.3573670387268066
324, She lay passed out with a bottle of pills strewn next to her .,6.5,3.22298526763916
325, The woman rests her hand on her head.,7.0,4.133767127990723
326, The day looks very sunny also.,3.25,2.9838504791259766
327, A woman points accusingly at a man.,4.25,3.7289624214172363
328," a young doctor is holding a folder and examining the reading on a device in her office, stethoscope around her neck.",7.0,2.856844902038574
329,Young families are on their own.,2.5,3.2656631469726562
330, Wonder what they are reading? Awesome .,1.75,3.1699025630950928
331, A gun is being held by two hands with the fingers on the trigger.,7.0,2.99613618850708
332, It's a pair of people throwing a kid out of the water in a pool.,6.5,3.0846147537231445
333,Honestly I can't tell what this is? I think it's a mouth because I see teeth but it is hard to be sure.,3.0,4.57666015625
334,How do you actually play all those drums?,2.75,3.363499641418457
335," A kid with a very deformed mouth, tongue sticking out.",5.0,2.8425748348236084
336,But you get it.,1.5,3.320049285888672
337, The lady is for sure dead and she has been dead for a while.,2.25,4.3157429695129395
338, This image makes me feel really sad.,1.0,2.9915390014648438
339,An image of a severed person's hand due to an accident many years ago in a country far from here.,6.5,2.8756630420684814
340, An old man in head to toe plaid is holding a pot of some kind of soup.,5.75,2.9078969955444336
341," In another country, there is a pile of naked or almost naked bodies on the floor, covered in blood and dirt.",6.25,3.996860980987549
342, A young girl is reading a book.,6.25,2.502387285232544
343, It is skinny and bloody.,6.75,3.3049519062042236
344," the mother and son are looking at something in the sky, maybe a plane or something or maybe a tv monitor.",2.75,3.138745069503784
345," Three kids are having fun in a pool, splashing in the water as they throw a friend up and out of the pool and into the water.",6.75,3.33209228515625
346, The guy is probably someone he knows since he isn't looking at .,2.25,2.444863796234131
347, An image of a man holding a gun and a kid running in a country far from here and many years ago.,6.5,3.5399327278137207
348," this is an injured, mangled face.",6.5,2.308553695678711
349," there is a girl by a car and she is screaming, she is crying.",6.25,3.918553352355957
350, Cute baby with an extremely large head compared to where it looks like his hairline is coming in.,2.25,2.9885613918304443
351," She looks mad at the guy and the guy is trying to figure out what he did, kind of funny .",1.25,3.800846576690674
352," This kid has his arms crossed and looks kind of upset, he might be in time out .",4.0,3.006620407104492
353, there is a burnt dead body on a table with a laceration on its left side.,6.75,3.602750539779663
354, There was a gun pointing towards someone.,6.5,3.3505704402923584
355, Probably a decent way to die though very quick/efficient.,1.5,2.6188552379608154
356, The baby is cute and seems happy.,2.0,2.61260724067688
357,"Sometimes I follow my breath, or I sit with the feeling of expansion in my chest.",6.5,3.6599478721618652
358, A lady is pointing at a man.,6.5,3.78800106048584
359, They are both standing next to other camouflaged soldiers.,6.5,3.1744847297668457
360," He looks relaxed, and the window is bright with trees outside.",4.25,3.792351245880127
361," The little girl, who looks older, is holding a blue pail.",6.75,3.248347282409668
362, Very marred body.,3.75,3.5750632286071777
363," It is dimly lit from the inside, but that might be the effect of the fire.",3.0,2.730907440185547
364," This image makes me feel romance, as if I am in some Victorian era melodrama with this being the hero who falls in love with the .",1.75,2.859286308288574
365, A man is skiing down a very steep slope.,6.0,4.88986349105835
366, It is cold because they have hats on.,3.25,5.39000129699707
367,  And seeing the eyes I can't imagine the suffering and I don't want to.,2.25,2.969451904296875
368, I feel pretty neutral towards this image but it does feel like this person is slightly judging me.,1.25,2.673567771911621
369, he could be a thief or murderer.,2.25,3.0928707122802734
370, That's a happy baby.,2.0,3.6313140392303467
371, the incident happened far from here.,6.75,3.391876697540283
372, the woman is holding her head and the man is gesturing at her.,6.5,2.6742005348205566
373, Person's features cannot be seen.,6.25,3.4343786239624023
374, I like the fact that interracial kids are reading together and hanging out together.,2.0,2.9569735527038574
375, It looks like it must be removed.,3.0,3.6460742950439453
376, a man is looking at the camera.,6.5,3.0468270778656006
377, He's smiling and seems to be looking at someone/something.,4.75,3.2702279090881348
378, She is impeaching him.,5.5,2.4347610473632812
379, I feel kind of hopeful.,1.5,3.863105297088623
380, it looks like a mutilated bloody face.,4.25,3.507290840148926
381, This one looks like burns maybe? Face is red and has lots of holes in it. I hate looking at holes in peoples.,2.5,3.243063449859619
382, There are multiple lacerations on his chest.,6.75,2.4108071327209473
383,There is a woman looking down and to the side with her finger on hr temple.,7.0,3.071444034576416
384, there is a dead beaten body with multiple stitches and some dried blood .,6.5,4.091039657592773
385, What happened? How did this happen? Can't tell gender of person.,2.75,2.5485544204711914
386," No emotion, good thing.",1.5,3.435880184173584
387, There is a man wearing a mask some time ago in the past.,6.5,3.13442325592041
388, The room looks pretty nice too so they can't.,1.75,2.467034339904785
389, A child was buried alive recently and is now being recovered dead.,6.75,3.0717780590057373
390, Little child is reading a book in a room.,6.25,2.4240057468414307
391, Child looking at viewer.,6.75,3.2097666263580322
392, a picture of a blurry hand with a knife being brought down.,6.25,3.224825382232666
393, a blurry stock photo of two people with guns trying to get through a door.,5.75,3.7464334964752197
394, I want a towel on my head always it's kind of warm and comforting just like this baby makes me feel I love tiny things his fingers are so small.,1.75,3.425252914428711
395, A man holds a gun to a woman's right cheek.,6.5,2.394333839416504
396, This photo makes me feel fine and neutral.,2.0,3.646409749984741
397," happened a week ago, terrorist attack, it is part of the past and we should let go.",6.0,5.544145584106445
398," Somewhere in the world, someplace in time, a car wreck has occurred.",6.5,2.9709420204162598
399,Every decision in blackjack can be dictated by simple math: There’s always a right and wrong answer.,4.25,2.7038183212280273
400, Really does not sit well with me.,1.75,3.924712657928467
401, There is a woman with glasses who is in the middle of talking.,6.25,3.609621047973633
402, A few children are smiling and staring ahead.,6.0,2.2534263134002686
403, They are in a parking lot.,6.5,2.7461156845092773
404, This photo is sad but still sweet and safe.,2.25,2.78910493850708
405, A individual under a black mask with only the eyes and mouth showing.,6.25,2.022592306137085
406, They don't look super comfortable.,2.5,2.7615675926208496
407, They are wearing long sleeved shirts and pants.,6.5,3.1616432666778564
408,"She edits them on her computer first in Adobe Lightroom, and then again with a suite of popular editing and filtering apps on her phone like Snapseed and Facetune.",5.0,2.973749876022339
409, There was a child who needed medical attention.,6.75,3.4574992656707764
410, there were bloodied bodies next to each other on the ground.,6.5,3.179975748062134
411, A man wearing a grey button down is standing with his arms crossed over his chest.,6.5,3.850773811340332
412, She is smiling.,6.25,2.868370532989502
413, He is wearing a collared shirt and has his arms crossed.,6.5,2.995215654373169
414,"Then, in shooting Maester Aemon’s death bed scene, Sapochnik graphically matched the cut, magically transitioning Aemon to his funeral pyre with his bed pillow still under his head.",4.75,3.1747400760650635
415," Woman seems distressed, and there seems to be someone comforting her.",3.5,2.627030849456787
416, A woman eats some kind of crop she just harvested with several children in the background doing the same thing.,6.25,2.971714973449707
417," A few decades ago, a man held a woman at knifepoint while covering her mouth.",6.5,3.004790782928467
418, still conscious so pain can't be too much.,2.75,2.931143283843994
419, A body is present.,6.75,3.512240409851074
420, It appears that they could be his parents yelling and fighting each other while ignoring the effect it has had.,3.5,6.232851982116699
421,An old picture of a little boy crying as he is held by a man.,6.75,3.7212514877319336
422," In another country, a woman is pictured and one of her breasts is covered in some sort of weird growth or tumor.",4.5,2.3004448413848877
423, she is also wearing a yellow and blue bracelet.,6.5,2.9541704654693604
424,"Once you start going deep, it can feel like a hall of mirrors, stretching on forever, each site very similar to the last, yet ever so slightly distinct.",1.75,3.5917255878448486
425, A gun is visible.,6.75,2.76353120803833
426, Hands are on a revolver.,6.5,2.9062633514404297
427, Feels like something that would be out of a textbook.,2.5,3.422165632247925
428, there is a little boy staring at me.,6.25,3.8282275199890137
429, she looks scared or uncomfortable.,3.0,3.1882529258728027
430, she looks very angry.,2.5,3.773716926574707
431, I have no feeling for the picture.,1.5,3.143512487411499
432, This is very far away from you physically.,6.75,4.69542932510376
433,My personal coding projects have presented similarly thorny ethical questions.,1.75,3.475271701812744
434,For my cross country coach.,7.0,2.3750386238098145
435, the hand was in a fist a long time ago.,6.5,6.043728828430176
436, She has a yellow head wrap and the baby has a blue hat on.,7.0,5.091733932495117
437, face of a man that looks sad or concerned.,3.25,3.0081369876861572
438,And pass.,6.0,3.1708195209503174
439, A woman screamed into a scared man's ear in a country far from here many years ago.,6.5,2.72757625579834
440," There was a woman who had recently been crying, who then decided to smoke a cigarette, or maybe she was smoking while she cried.",5.0,2.7197370529174805
441, there is a black boy that has half his cheek cut off and shows his teeth and bones.,6.5,3.3960087299346924
442, There is a guy with a knife held up to a woman's throat.,7.0,2.6251771450042725
443, A man pointing a gun to the camera.,7.0,2.4686782360076904
444, a baby is smiling happily at the camera.,4.0,2.8444643020629883
445, A woman is screaming in the background and has her hands up in a very exasperated way.,3.25,2.9253907203674316
446, Man is clearly very aggressive.,2.25,2.5136919021606445
447, There is a severe loss of blood every.,4.5,4.873305797576904
448, A woman is letting the blood out of a tiger in preparation of cooking it.,6.25,3.2497410774230957
449, A man is holding a gun.,6.75,2.442540168762207
450, The young woman's arms are around his arm.,6.0,2.763152599334717
451, there is a woman that has recently been slapped by a man her face looks almost happy .,3.5,3.3573670387268066
452, A boy is badly burned and his face looks distressed.,3.5,3.22298526763916
453," A body is buried in the dirt, and it looks like a young child.",5.0,4.133767127990723
454, The son seems pretty boxed in.,3.5,2.9838504791259766
455, the hand is going to plunge the knife into something.,6.25,3.7289624214172363
456, this is a woman standing in an apartment on the phone.,6.5,2.856844902038574
457, the knife was touching her throat and close to cutting it.,6.75,3.2656631469726562
458, His mouth is open and he's cleared dead.,6.5,3.1699025630950928
459, Being patrolled by some guy with a gun.,5.0,2.99613618850708
460, The baby seems to be laughing and happy.,2.75,3.0846147537231445
461, He looks rather disappointed.,2.5,4.57666015625
462, Another mutilated face.,6.25,3.363499641418457
463, The person had hair.,6.5,2.8425748348236084
464, A man who is about 25-30 years old.,5.75,3.320049285888672
465, A young child is seen with severe wounds on this chest and face.,6.0,4.3157429695129395
466, Man about to shoot himself with gun.,6.0,2.9915390014648438
467, A lady throwing like pieces of a rose to a guy and she has an angry facial expression toward.,2.75,2.8756630420684814
468," He is older, and is probably expecting guests.",2.75,2.9078969955444336
469, a woman is pointing at a man with a displeased look on her face.,4.25,3.996860980987549
470, There are two men inside a house.,7.0,2.502387285232544
471,"A woman happily posing for a picture on the beach, based on the hairstyle and image quality some time in the 70s or 80s.",6.0,3.3049519062042236
472, It is leaving on a pillow and looking at something above it.,6.25,3.138745069503784
473," music festival and guy enjoying the guitar, looks like a fun time.",2.0,3.33209228515625
474, They seem focused on the contents of the book.,3.0,2.444863796234131
475,"I feel slightly nervous when looking at this image of the baby, but I feel pretty alright since it seems like the baby is being taken care of.",1.75,3.5399327278137207
476,"As I got closer I realized that those things were six different drums—metal poles, pedals and large metal disks, which I later learned were cymbals—all lying on the lawn waiting to be loaded in for what I now know was a band rehearsal.",4.5,2.308553695678711
477, a baby is on the blanket on the ground.,6.5,3.918553352355957
478, All three kids are smiling.,6.5,2.9885613918304443
479,Some people say that I should study to become a climate scientist so that I can ‘solve the climate crisis.’ But the climate crisis has already been solved.,2.0,3.800846576690674
480, A young child's corpse is found underneath some dirt and small rocks.,6.25,3.006620407104492
481, I feel bad for the kid.,2.25,3.602750539779663
482, There was an argument where a girl was screaming at a guy who has a shocked expression on his face.,5.75,3.3505704402923584
483, The apartment is pretty shadowed but you can see a plant and a chair.,6.0,2.6188552379608154
484, A group of kids is having a bunch of fun in a pool and it looks like one perhaps has cancer.,2.25,2.61260724067688
485,What makes a parent decide not to vaccinate their kids?,2.25,3.6599478721618652
486," They appear to have suffered from very sever wounds, as they are covered in blood.",2.75,3.78800106048584
487, Photo feels soft and playful.,2.0,3.1744847297668457
488, A cute baby with a towel or sweater on its head.,4.0,3.792351245880127
489," the child looks annoyed and unhappy , he is covering his ears.",3.0,3.248347282409668
490, Looks like an accident of some sort.,3.0,3.5750632286071777
491, There is a baby smiling to something off camera.,6.25,2.730907440185547
492," Somewhere in the world, someplace in time, a tiger is being slaughtered or sacrificed.",6.25,2.859286308288574
493, dinner outside at some place with deforestation .,6.25,4.88986349105835
494, This is an image of a pathway through some foliage.,6.5,5.39000129699707
495, A woman with big curly hair has injuries to her left eye that show green bruising underneath and her right eye has a cut/bruise under it as well.,5.5,2.969451904296875
496, This little boy is being thrown up from the pool by his siblings (?) and is about to cannonball back down into the water.,3.25,2.673567771911621
497,"The surveillance dystopia is on the horizon, and companies like Microsoft and Amazon are helping build it.",2.0,3.0928707122802734
498,A man is staring at the camera and smiling.,6.25,3.6313140392303467
499, Very clean looking suits.,3.5,3.391876697540283
500,He's wearing a cowboy hat and country style clothing.,6.5,2.6742005348205566
501, There is a man maybe lying on a hospital bed or on the ground.,6.5,3.4343786239624023
502, This occurred a long time ago and was in a country far away.,5.25,2.9569735527038574
503, there's a guy with a gun behind him who doesn't look black.,3.75,3.6460742950439453
504, This image makes me smile a bit because it's a cute image.,1.25,3.0468270778656006
505,"The numbers aren’t terribly shocking, especially if you’re familiar with similar stories about the early years of the film industry in America: “About 1,700 silent films were made in India of which the National Film Archive of India has only 5 to 6 complete films and about 20-25 films in fragments.",3.25,3.2702279090881348
506, Had boils over his face.,6.25,2.4347610473632812
507, White guy with gun is pointing it and yelling at black male driver.,6.5,3.863105297088623
508,"a long time ago in a far away country, an infant was malnourished and taken to the hospital.",6.0,3.507290840148926
509," This is a photo of two people sitting on opposite sides of the bed with their arms crossed, like they're fighting or ignoring each other.",3.0,3.243063449859619
510, I wonder if that is actual person and what has happened to the person.,2.25,2.4108071327209473
511,I’d finally and inevitably resort to “accidentally,2.0,3.071444034576416
512," man with deformed face, lips missed so teeth exposed, right eye very messed up can see white, nose not there just a hole.",6.5,4.091039657592773
513, I was that child sometimes and I feel HORRIBLE for this child.,1.0,2.5485544204711914
514," Three men stand together, wearing tuxedos.",6.75,3.435880184173584
515, there is a baby looking at the camera the baby is on a pillow.,7.0,3.13442325592041
516, there is a little girl with a teddy bear watching her parents fight.,6.25,2.467034339904785
517, She holds a black shirt up.,7.0,3.0717780590057373
518, a really graphic and disturbing picture of somewhere in Africa in the 90s with lots of bloody naked bodies in the street and they look really bad.,3.25,2.4240057468414307
519, the criminal got fierce during his trial in the court.,3.25,3.2097666263580322
520, That's very disturbing is that even human? If it is very graphic.,2.25,3.224825382232666
521,"“I want cracking down on all of that ‘bought’ stuff, people who buy verification, even loop giveaways,” says Lisa DiCicco Cahue (@lisadnyc), a fashion and lifestyle influencer with 100,000 followers who also works as a model.",5.75,3.7464334964752197
522, A little boy is very bloody and looks in pain and shock.,3.5,3.425252914428711
523, This occurred a long time ago and this severed hand was cut off.,6.25,2.394333839416504
524,"“Door County is host to more than a few top-notch theatres,” she says.",5.5,3.646409749984741
525, Super cool! They look very focused and intent to do this .,1.75,5.544145584106445
526, I'm happy he's smiling.,1.25,2.9709420204162598
527, a man facing away from the camera is pointing a gun at his temple.,6.75,2.7038183212280273
528, A man is causing distress to a woman.,3.25,3.924712657928467
529, This mans face is very large and his features take up a small portion like there is so much whitespace it's like there's a page requirement for a paper but you have nothing to write.,2.5,3.609621047973633
530,This issue isn’t just about fashion.,1.75,2.2534263134002686
531, The girl has a pail in her hand.,7.0,2.7461156845092773
532, they seem to be at a wedding.,5.25,2.78910493850708
533, This image makes me feel happy.,1.25,2.022592306137085
534, A person has a gun pointed at a guy in the car.,6.75,2.7615675926208496
535, Three kids in a pool.,7.0,3.1616432666778564
536," a few years ago, an old man was looking for food to eat in his fridge.",6.0,2.973749876022339
537,A young baby boy is looking up.,6.25,3.4574992656707764
538," That is the look of anger/disgust and on the man, pure shame.",1.0,3.179975748062134
539,You know that?,3.0,3.850773811340332
540, He is wearing a watch on the hand that is covering her mouth and the woman is wearing a blouse.,6.75,2.868370532989502
541, There was a man who held a gun at a woman's neck and she also had her mouth covered by him.,6.75,2.995215654373169
542, The girl is blocking a creepy guy from her way.,3.25,3.1747400760650635
543, Another woman on the floor looks on at the .,6.75,2.627030849456787
544, an old photo from Sweden of a mom disciplining her kid as he sits in a closet .,4.5,2.971714973449707
545," This is a picture of a young boy, looking into the camera.",5.5,3.004790782928467
546, there are two people pointing their guns into a room in a very worn down building.,6.0,2.931143283843994
547, A little kid looking pretty puzzled.,4.0,3.512240409851074
548, It looks like a cartoon drawing - not as clear as a photographic image would be.,2.75,6.232851982116699
549, The mom is gesturing with her hands while the father stands there and is listening.,6.0,3.7212514877319336
550, She looks upset but like a fake upset where she's trying to pose for the troubled look.,2.25,2.3004448413848877
551,And I’m not interested in ever being pregnant again.,1.25,2.9541704654693604
552, she is holding a teddy bear and standing in the hallway.,6.75,3.5917255878448486
553, I cannot tell at all what is going on here.,1.0,2.76353120803833
