,response,score,observed
554, A man is being involved in a situation between himself and police officers.,6.5,2.9062633514404297
555, He is threatening this young man.,3.5,3.422165632247925
556, It looks like a normal kid living a normal life.,2.75,3.8282275199890137
557, He is of an old age.,4.5,3.1882529258728027
558," This is a photo of an older man with a white beard, wearing some kind of uniform with snow on it.",4.5,3.773716926574707
559, A man is being held at gunpoint in a car which is scary.,2.5,3.143512487411499
560, She is probably in an argument with him.,2.5,4.69542932510376
561, A baby girl is looking up at the camera from tummy time.,5.5,3.475271701812744
562, A criminal with his mouth covered trying to scream something to a lawyer prob and he is at a trial .,2.75,2.3750386238098145
563, they were both around their 30s .,3.0,6.043728828430176
564,"And the Parkland students have continued throughout the year to travel this country and the world, advocating for stricter gun regulations.",6.0,5.091733932495117
565, The room looks very cramped and he can't fully stretch out.,3.5,3.0081369876861572
566,She's playing with a spoon.,6.75,3.1708195209503174
567, A musical artists sits in a chair in front of a microphone.,6.5,2.72757625579834
568, A child is badly injured and covered with blood.,5.5,2.7197370529174805
569, She is looking really sad.,1.75,3.3960087299346924
570, This man in camouflage was pointing a rifle at a cameraman that is not me a long time ago; this happened far away from here.,5.5,2.6251771450042725
571, The hand has been amputated at the wrist and there is still blood covering the hand.,4.75,2.4686782360076904
572, She is observing.,5.5,2.8444643020629883
573," these kids look like they are having fun, the boy probably just jumped off of the diving board .",3.5,2.9253907203674316
574," A very mutilated hand is shown over a pool of blood (and water I hope, or that is a LOT of blood).",3.5,2.5136919021606445
575, An old man is standing leaned on a wall in some home.,5.5,4.873305797576904
576, She is at the beach in a blue shirt.,6.75,3.2497410774230957
577, There are people are in a field.,5.5,2.442540168762207
578, There is a small girl with bangs sitting on a child sized chair reading a book.,5.75,2.763152599334717
579," he just chilling and singing a country song, probably entertaining an audience.",4.0,3.3573670387268066
580, It makes me feel bad for what his about to do.,1.5,3.22298526763916
581, They all have their heads bowed down so are likely unconscious or passed out.,2.75,4.133767127990723
582, Wonder what he is looking for.,2.25,2.9838504791259766
583," blown in the face again, pretty lasting damage, probably not survived the impact sorry for the pain .",2.75,3.7289624214172363
584, She has a cigarette in one hand.,6.75,2.856844902038574
585, There is a woman pushing a man away.,6.25,3.2656631469726562
586," What an adorable baby, very cute.",2.5,3.1699025630950928
587, His right eye is missing and there is blood pooling in the gash.,6.0,2.99613618850708
588, Really not fun to look at.,2.0,3.0846147537231445
589, The same man from earlier is holding the same knife to the same woman's throat.,5.75,4.57666015625
590," Long time ago, far away, a man probably hit a woman real hard in the face; her face went backward.",6.25,3.363499641418457
591,"If you analyze the thousands of football games played in the last 10 years, you can devise a set of rules that almost always lead to a win.",3.5,2.8425748348236084
592,"I attend therapy every week, pop a little blue pill every morning and, just as importantly, I lean heavily on my pulse checkers.",2.0,3.320049285888672
593," There is an older couple who are by the water, enjoying a nice summer day.",3.75,4.3157429695129395
594,"In short, we make believing in climate change the better option.",2.5,2.9915390014648438
595,Woman smiling and sitting on beach.,6.5,2.8756630420684814
596, There seems to be a crowd .,5.0,2.9078969955444336
597, there is a man looking at a woman with her hands up.,6.75,3.996860980987549
598, a man and woman are in the kitchen.,6.5,2.502387285232544
599," A few people are about to bash and rob/hurt someone in the car, with a gun.",6.25,3.3049519062042236
600, Child with blond hair and blank stare.,6.0,3.138745069503784
601, The mother is not happy.,2.0,3.33209228515625
602, This grandma needs to get back on the job rather than just eating whatever it is they're picking.,2.5,2.444863796234131
603, The young boy looks concerned and possibly scared at his mother's anger.,3.0,3.5399327278137207
604,Sarah Titus understands this keenly.,3.5,2.308553695678711
605, There is an adult looking up at something above and a child looking up along with the adult.,6.25,3.918553352355957
606, A sad girl she looks Hispanic .,1.0,2.9885613918304443
607, It's hard to tell which part of the body this is.,2.5,3.800846576690674
608,"Between rights issues and the degradation of negatives, movies like “Household Saints” may never be distributed again.",6.0,3.006620407104492
609,there is a baby girl in a incubation chamber holding her mothers hand.,6.75,3.602750539779663
610," black woman, dark lighting, looking at camera and crying, looks dressed up nicely, very sad, hand under chin, dejected, silently crying.",2.25,3.3505704402923584
611, the child has an iv or something that is hooked up to a machine.,5.25,2.6188552379608154
612, That's extremely bloody and scary!.,2.0,2.61260724067688
613, There is a little baby in a pile of dried leaves.,5.75,3.6599478721618652
614, Another mutilation that idk looks pretty congenital .,2.5,3.78800106048584
615, the boy was laying on the bed in a hospital during his treatment.,6.5,3.1744847297668457
616, the woman took drugs and is passed out.,6.0,3.792351245880127
617, A couple looks like they are at odds.,3.25,3.248347282409668
618, There is blood everywhere.,6.25,3.5750632286071777
619,"From the plumes, Cassini found carbon-bearing molecules, salts and chemical signposts of hot water reacting with rock deep in the region of the plume's source, beneath the icy moon's surface.",6.75,2.730907440185547
620, Kinda creeped out she is just staring.,2.5,2.859286308288574
621,The area behind here has a high chair .,6.5,4.88986349105835
622, Not a clean cut looks like it was hacked off.,2.75,5.39000129699707
623," A man and a woman are talking, the woman is trying to explain something.",5.0,2.969451904296875
624, They all look fairly old and are all wearing glasses.,4.5,2.673567771911621
625, she is trying to grab his arm and fight him off.,4.75,3.0928707122802734
626, Two young children seem to be enjoying their walk on the beach.,3.75,3.6313140392303467
627, A man is bullying a person in public .,4.5,3.391876697540283
628," Next to her left hand is a bottle of pills, some of which are in the bottle and some of which are on the bed.",6.75,2.6742005348205566
629,"She ended up divorcing her adulterous husband, only to be ordered by a judge to get a job to support her kids.",6.5,3.4343786239624023
630, Soldiers were redirecting an injured civilian yesterday.,6.75,2.9569735527038574
631, A man is looking directly at the camera with a relaxed look on his face.,4.25,3.6460742950439453
632,A woman suffers from facial injuries.,6.25,3.0468270778656006
633, A guy skiing downhill about to jump; pretty cool and exciting.,1.75,3.2702279090881348
634," Actually, I can't tell if she is alive or not.",1.25,2.4347610473632812
635, it looks more disgusting than scary because this is way too much to be realistic unless that woman went through a literal fire.,1.75,3.863105297088623
636, it looks like his hand is covering her mouth.,3.5,3.507290840148926
637, This is an image of someone holding a gun and wearing a bandana on their face in a country far from here and many years ago.,6.5,3.243063449859619
638,But all they needed to do was play basic strategy—and let the clock run.,3.5,2.4108071327209473
639,two adults argued a long time ago.,5.75,3.071444034576416
640,Which compels a seasoned internet traveler to ask: What are they doing?,4.75,4.091039657592773
641, A woman is holding a man by his shirt and appears unhappy.,4.0,2.5485544204711914
642,"A person or corpse, there is a massive cut in the side of their face and their eyes also seem gauged out or bloody.",6.25,3.435880184173584
643,"PEW studies when people consume news, but only certain things are characterized as 'news' as far as PEW is concerned.",4.25,3.13442325592041
644,There is a chubby baby with his eyes open and his little mouth open with his tongue visible.,5.25,2.467034339904785
645, He is wearing a black long-sleeved shift.,6.75,3.0717780590057373
646, They both look like they are crying and they are outside.,5.25,2.4240057468414307
647,Do not ever do this.,1.25,3.2097666263580322
648, He also has a bowl cut.,6.25,3.224825382232666
649,This dude looks really creepy his smile is very scary.,1.5,3.7464334964752197
650, five people with covered faces are chained to the back of a truck or something.,5.75,3.425252914428711
651, A woman seems annoyed while a slightly older woman is shown standing behind her.,3.5,2.394333839416504
652,Instagram has become flooded with posts sporting the ubiquitous #ad or #sponsored captions — language that is required by US Federal Trade Commission endorsement laws — underneath photos of a new jewelry line or eye cream.,6.25,3.646409749984741
653,A baby is laying on some sheets.,7.0,5.544145584106445
654," child laying in bed, covered in blood, something in mouth, can't tell if alive, looks dejected and half asleep all skin peel.",4.75,2.9709420204162598
655, Another man is pointing aggressively at the man on the ground.,3.75,2.7038183212280273
656," In a far away country, someone is being rushed to receive medical attention.",6.25,3.924712657928467
657, This is a blurry image of two people with guns moving towards a door.,5.25,3.609621047973633
658,"I was doing it, at least partially, to prove what I could accomplish to other people; to fit the mold of the person I’d shaped myself to be.  ",1.0,2.2534263134002686
659, one man in a suit is holding the other up near a bridge.,6.25,2.7461156845092773
660,"It also means to weigh ideas, to compare and contrast assertions, to connect one generalization to another.",4.75,2.78910493850708
661, A man looks like he might be uncomfortable what is going on.,1.25,2.022592306137085
662, It is a store front and the man is doing what he should do.,3.0,2.7615675926208496
663, They are sitting as far apart on a bed as possible.,4.75,3.1616432666778564
664,Start-ups for pockets?,5.0,2.973749876022339
665, This teacher looks very surprised and is probably confused at something one of her students has done or said.,3.5,3.4574992656707764
666, They are on a train or subway of some kind.,6.0,3.179975748062134
667, Their glasses are fun.,1.0,3.850773811340332
668, she looks sad and in pain and wants to get help.,1.0,2.868370532989502
669, He is laying in a bed.,6.75,2.995215654373169
670, The beach is nice and the water is very blue.,3.25,3.1747400760650635
671, Blood is in a metal can.,5.25,2.627030849456787
672,"Over the course of the game, the Falcons were gaining an above-average 5.8 yards per rush (the league average is around 4.3 yards per play).",7.0,2.971714973449707
673, Another hand is brushing off some of the dirt .,6.25,3.004790782928467
674, He looks like he's in a hospital though and it doesn't look fatal so hopefully he's ok .,3.75,2.931143283843994
675, This man looks like he is about to commit a mass murder based on his face and the weapon he has in his hand.,2.25,3.512240409851074
676," He is dressed in long layers, and the curtain is white.",6.5,6.232851982116699
677, The figure the hand belongs to is hidden and the background is totally black.,6.75,3.7212514877319336
678," happened a long time ago looks like a protest, planned .",4.5,2.3004448413848877
679, Older white me that look unhappy or angry.,3.0,2.9541704654693604
680, the other people are casually dressed.,3.75,3.5917255878448486
681, they are wearing the same outfit and crossing .,6.5,2.76353120803833
682, This is an image of a woman that was beaten and suffered facial injuries.,6.5,2.9062633514404297
683, the blood seems to be coming from his upper extremities.,4.5,3.422165632247925
684, The entire right side of his face is covered in boils and his ear and back of his head have turned black.,6.75,3.8282275199890137
685," I really can't even look at this, it's too real.",2.0,3.1882529258728027
686,"“If you extrapolate from either figure, tallying songs on album and singles masters, the number of destroyed recordings stretches into the hundreds of thousands,” Rosen wrote.",6.5,3.773716926574707
687, The child looks a little sad or scared.,3.25,3.143512487411499
688, I can see the man's eyeball that has popped out from where it is supposed to be.,5.5,4.69542932510376
689,Inside of a mouth? .,5.75,3.475271701812744
690, They are both legs/arms crossed and on opposite ends of the bed looking away from one another .,6.5,2.3750386238098145
691,A woman's face has a huge scar that has left an open wound on the right side of her cheek all the way to her forehead.,6.25,6.043728828430176
692,Her first sponsored posts in 2016 were with smaller brands; she’s since collaborated with heavyweights like H&M and Glamour magazine.,5.75,5.091733932495117
693, The child is looking at the camera.,6.75,3.0081369876861572
694, This person may have died violently.,4.5,3.1708195209503174
695," Long time ago, far away, a woman probably passed out after overdosing on drugs/meds.",5.25,2.72757625579834
696," Black man has laceration on abdomen and chest, he seems beaten.",4.75,2.7197370529174805
697, His hair is very neat.,2.75,3.3960087299346924
698," A photo of a different time, maybe late 80s? Makes me want to go vacation.",2.5,2.6251771450042725
699," It seems to be a baby girl, as she is wearing a dress.",3.0,2.4686782360076904
700,I'm reminded of a recent study from PEW.,4.0,2.8444643020629883
701, A man with blood on his t shirt and military people.,6.5,2.9253907203674316
702, This was a tense situation of a man holding a gun to a woman's face.,3.5,2.5136919021606445
703," somewhere in the world, someplace in time, two people look bored while sitting on the couch.",3.25,4.873305797576904
704, There are hands cupping the face and holding it in place.,6.75,3.2497410774230957
705,"You might as well say ‘no humans,’ you know?",4.5,2.442540168762207
706,"baby girl in ICU, lots of tubes to help breath, something attacked to stomach, doesn't look healthy.",3.75,2.763152599334717
707," The scene seems gloomy, and the person does not seem very hopeful.",1.0,3.3573670387268066
708," This makes me feel slightly uncomfortable, almost like I'm not suppose to be here watching them.",1.0,3.22298526763916
709, A woman has messy makeup and a cigarette some time ago in the past.,4.5,4.133767127990723
710, criminals tied up after a fight happened far away .,6.75,2.9838504791259766
711, She is holding a teddy bear and has pigtails.,6.75,3.7289624214172363
712, I think it's a human but there's a lot of discoloration and bloating of the skin.,4.0,2.856844902038574
713, They both have their arms crossed and are not looking at each other.,6.75,3.2656631469726562
714, This is an image of a woman getting abducted into a van.,6.5,3.1699025630950928
715, A man is looking away while a woman is screaming and throwing her hands up in the air.,6.5,2.99613618850708
716,Don't focus on telling people that what they have chosen to believe isn't true.,3.5,3.0846147537231445
717, They look relatively young.,4.0,4.57666015625
718,They are hardworking and goal-oriented.,4.0,3.363499641418457
719, She seems upset and he seems surprised at her reaction.,1.0,2.8425748348236084
720, I don't know exactly what happened to this woman but she looks really nasty.,1.0,3.320049285888672
721, He is surrounded by a fire in the background and looks like he is in some sort of riot zone.,6.0,4.3157429695129395
722, This is a patient who has been beat up or burned very badly on his face.,4.75,2.9915390014648438
723,Many of them share almost identical design themes.,5.0,2.8756630420684814
724, There is an image of a white guy.,6.25,2.9078969955444336
725, this is picture of a Swedish couple fighting as their young child watches.,5.25,3.996860980987549
726, A man is holding a knife over a woman's throat while clasping her mouth so she can't scream.,6.25,2.502387285232544
727, White man has silver hair.,5.75,3.3049519062042236
728, A man has unusually inflamed eyes and they are discharged.,5.25,3.138745069503784
729," surprised baby, super cute with the dress up, sees something she is interested in, playful.",3.0,3.33209228515625
730, HE is wearing a colorful tie and white shirt .,6.0,2.444863796234131
731,"Online, we were labeled as criminals — or worse.",3.0,3.5399327278137207
732, A mans face is extremely deformed by some sort of disease.,4.5,2.308553695678711
733, A woman holding a cigarette in her left hand and is wearing eye liner.,7.0,3.918553352355957
734, There is a man and woman with arms crossed on opposite sides of the bed.,7.0,2.9885613918304443
735,"The picture is very blurry, one person is holding a gun, another is holding something we cant see b but it looks like the home they are in is already in shambles.",3.0,3.800846576690674
736," A guy staring at me, unimpressed.",1.75,3.006620407104492
737, It is hard to look at the burns because they are so bad.,1.0,3.602750539779663
738,a young woman is sitting on a beach.,6.75,3.3505704402923584
739," A man holds a gun to his own head, with his finger on the trigger.",7.0,2.6188552379608154
740, The man with the gun is wearing a hat.,7.0,2.61260724067688
741, A mans head is being held.,7.0,3.6599478721618652
742, Someone may have punched her in the face.,4.0,3.78800106048584
743," A car is flipped over, and firefighters are tending to someone lying next to the car.",7.0,3.1744847297668457
744," This is a calming image, stress free.",1.25,3.792351245880127
745, You can barely make out that this used to be a person's face.,3.5,3.248347282409668
746, She is wearing a denim light jacket.,7.0,3.5750632286071777
747, The boy looks sad.,1.0,2.730907440185547
748, Man with some cooled soup.,7.0,2.859286308288574
749,There is a smiling man with a moustache and dark brown hair.,6.75,4.88986349105835
750, He has a watch on and the knife is short and black.,6.75,5.39000129699707
751," A knife is being held in an aggressive manner, I'm not really sure if it is being used to assault anyone.",1.0,2.969451904296875
752,I don't know what the hell I'm looking at but I hate it bloody and gross.,1.25,2.673567771911621
753," This boy is leaning against a brown wooden fence wearing a red shirt, jeans, and white shoes; this does not evoke any strong emotions in me.",5.0,3.0928707122802734
754,"But, then again, Door County isn’t your typical sleepy rural community.",2.0,3.6313140392303467
755, There's a guy with a gun.,7.0,3.391876697540283
756, Two preteen kids are throwing up a smaller boy in the pool.,7.0,2.6742005348205566
757," tiger getting harmed, very sad animal abuse .",2.25,3.4343786239624023
758, An adult's finger is touching their hand.,7.0,2.9569735527038574
759, His entire upper torso and face is covered in welts and bleeding blisters.,6.75,3.6460742950439453
760,The answer is clearly no.,2.0,3.0468270778656006
761, The skin has come off of most of the hand.,6.5,3.2702279090881348
762, there is an incision a few inches above her vagina.,6.5,2.4347610473632812
763, There was a middle aged man who was covered in blood and it was awful.,3.0,3.863105297088623
764, she probably does this often as he has a pained .,1.75,3.507290840148926
765,"Most mornings of my freshman year of college I’d get up at 5:30, well before anyone else in my dorm was awake.",3.75,3.243063449859619
766, The man on the left is wearing glasses.,7.0,2.4108071327209473
767," Decades ago, a woman had a gun pressed to her face by a man who was forcibly restraining her.",6.5,3.071444034576416
768, A man holds a gun to a woman's face.,7.0,4.091039657592773
769,A police officer is arresting someone in the past.,7.0,2.5485544204711914
770, there is a man dressed like a modern cowboy with a guitar that is singing into a microphone while sitting.,6.0,3.435880184173584
771,How the fuck am I going to shoot this?',1.0,3.13442325592041
772, these two people are waving by on a vacation but they isn't going anywhere their boat already dipped in the back lmao I'm annoyed by them.,3.0,2.467034339904785
773, Two of them have beards and the third man doesn't.,6.75,3.0717780590057373
774, There is a small baby that has a tube in its mouth and splint around its arm.,6.25,2.4240057468414307
775,Not all influencers think spending that much money on clothes is necessary.,4.25,3.2097666263580322
776,A baby is emaciated and has tubes over his/her face.,4.5,3.224825382232666
777, The photo shows a storefront selling meat. A man works in front of the storefront.,7.0,3.7464334964752197
778, Kid is in cupboard looking up.,7.0,3.425252914428711
779," A child looks somewhere past the camera, maybe 1 or 2 years old.",5.75,2.394333839416504
780, the side of his face is all burnt and the flesh looks bubbling and charred.,5.75,3.646409749984741
781," parents fighting in kitchen in front of child holding teddy bear, man looks disinterested while woman looks ""hysterical"", staged photo.",1.75,5.544145584106445
782,"Blogger Aimee Song (@songofstyle) — one of the most famous influencers on Instagram, with 4.7 million followers — explains, “When I was starting out, I thrifted a lot and because I worked at two different retail stores, I got a discount.",6.75,2.9709420204162598
783, They are white and the shirt is a long-sleeved.,6.5,2.7038183212280273
784,This photo touches me in an odd way.,1.0,3.924712657928467
785,"One month you get a couple of high-paying brand collaborations, and the next month, none.",6.0,3.609621047973633
786, A boy is posing for a picture.,6.25,2.2534263134002686
787, A female cop is seen looking into the room in which the man is lying.,6.5,2.7461156845092773
788,"So I wanted to be that binder queen,” she said.",4.0,2.78910493850708
789, The seated one has her hand on her head.,7.0,2.022592306137085
790, Man has his face blown up by a gun.,7.0,2.7615675926208496
791, The picture is extremely gory.,1.25,3.1616432666778564
792, This is an image of a man pointing a gun at the camera.,6.75,2.973749876022339
793, a picture of a man with dark hair and grey eyes staring at the camera intensely.,5.75,3.4574992656707764
794,"In blackjack, this is like standing a soft 17: an ace and six.",7.0,3.179975748062134
795, They seem happy and are all wearing tuxedos.,3.0,3.850773811340332
796, An image of a man attempting to choke a woman but this was years ago in a place far from here.,6.25,2.868370532989502
797, A close up of a woman.,6.5,2.995215654373169
798," happy blonde baby lying on pillow on the floor with arms and legs outstretched, red carpet.",3.75,3.1747400760650635
799, He does not look like a very nice guy based on his expression.,1.0,2.627030849456787
800,Sometimes you doubt why she’s giving away everything.,1.0,2.971714973449707
801," white man red lighting looks like he's in the middle of talking, wearing suit can only see the top to chest, not looking at camera, short black hair, passionate.",3.0,3.004790782928467
802, A man has been dead for a while and the police officer is looking at him.,5.25,2.931143283843994
803," A woman seems bored and is placing her hands on her face, while another guy next to her is lounging on the couch also looking bored.",5.0,3.512240409851074
804,"This is weird, because in the media industry we keep attributing the filter bubble to young people, like blaming YouTube for creating a filter bubble for recommending similar videos.",2.25,6.232851982116699
805, It looks like his face was melted off.,2.0,3.7212514877319336
806, There is a man who seems to have been disfigured by some accident.,3.0,2.3004448413848877
807, His shirt and pants are plaid - the combo would be cool today.,1.0,2.9541704654693604
808, He seems to be enjoying himself.,1.0,3.5917255878448486
809," She looks like she has been crying, she seems angry.",1.0,2.76353120803833
810, this is a man wearing red and sunglasses holding a gun to the head of a man wearing white.,7.0,2.9062633514404297
811,This is a healthy baby holding a dinger in its chubby Michelin man arms.,5.0,3.422165632247925
812,But the company decided not to use it when we discovered it would push women away from computer science classes.,5.25,3.8282275199890137
813,"They are not living in a filter bubble, but something has happened that has caused them to choose not to believe what is general knowledge.",3.0,3.1882529258728027
814, I feel full of life looking at this photo and feel quite happy.,1.75,3.773716926574707
815, There is a body lying down in front of someone.,6.5,3.143512487411499
816, He possibly is upset that no one wants to hear him perform and does not look comfortable.,3.0,4.69542932510376
817, They are smiling at something past the camera.,7.0,3.475271701812744
818,An old white man is grabbing the curtain to look out the window to see a tree.,5.0,2.3750386238098145
819,"Person, exhausted, sitting by window.",2.0,6.043728828430176
820, It's pretty cute and chubby.,1.0,5.091733932495117
821, the girl is assessing her self-image right in front of the mirror.,6.0,3.0081369876861572
822, A chef is holding a baby.,7.0,3.1708195209503174
823, A woman seems to be going through a tough time.,1.75,2.72757625579834
824, There is a woman very expressively yelling at a guy who is in some shock but is also not engaging with this woman.,1.0,2.7197370529174805
